category,score,summary,weight,weighted_score
revenue,10.0,Strong multi-year growth receives the highest weight in the model.,0.16,1.6
profitability,44.0,Margins measure structural business quality and pricing power.,0.16,7.04
returns,14.0,Return ratios reward efficient use of capital and assets.,0.16,2.24
balance_sheet,100.0,Leverage and liquidity determine resilience through weaker cycles.,0.16,16.0
cashflow,92.0,Cash conversion and free cash flow anchor the quality check.,0.16,14.72
valuation,0.0,Valuation is intentionally harsh on expensive equities.,0.1,0.0
red_flags,90.0,Triggered red flags reduce confidence in the headline metrics.,0.1,9.0
overall,50.6,value trap / governance trap,1.0,50.6
